{
  "name": "optimize-memories",
  "version": "0.1.0",
  "description": "Audit, verify, reconcile, and update Codex memory artifacts across project and global scopes through evidence-based, approval-gated procedures.",
  "author": {
    "name": "Nery Samuel Murillo",
    "email": "nerymurillohnd@gmail.com",
    "url": "https://github.com/nerymurillohnd"
  },
  "homepage": "https://forestal-mt.com",
  "repository": "https://github.com/nerymurillohnd/codex-essentials",
  "license": "MIT",
  "keywords": ["codex", "memory", "audit", "verification", "knowledge-management"],
  "skills": "./skills/",
  "interface": {
    "displayName": "Codex Memory Audit",
    "shortDescription": "Audit and reconcile Codex memory artifacts with evidence.",
    "longDescription": "Codex Memory Audit provides a phase-gated process for auditing project and global Codex memories. It verifies claims against official documentation and current state, maintains evidence-backed ledgers and matrices, and produces complete proposed changes that await explicit approval before any mutation.",
    "developerName": "Nery Samuel Murillo",
    "category": "Developer Tools",
    "capabilities": [
      "Project and global memory audits",
      "Official documentation and source verification",
      "Atomic claim ledgers and evidence matrices",
      "Approval-gated memory change proposals"
    ],
    "websiteURL": "https://forestal-mt.com",
    "privacyPolicyURL": "https://forestal-mt.com/privacy/",
    "termsOfServiceURL": "https://forestal-mt.com/terms/",
    "defaultPrompt": [
      "Audit Codex memories in project, global, or complete scope; verify claims and await approval before changes."
    ]
  }
}
