{
  "name": "block-no-verify",
  "version": "0.1.0",
  "description": "Recommend and install an approval-gated Codex hook that blocks Git verification and signing bypasses.",
  "author": {
    "name": "Nery Samuel Murillo",
    "email": "nerymurillohnd@gmail.com",
    "url": "https://github.com/nerymurillohnd"
  },
  "homepage": "https://forestal-mt.com",
  "repository": "https://github.com/nerymurillohnd/codex-essentials",
  "license": "MIT",
  "keywords": ["git", "commit", "verification", "gpg-signing", "codex-hooks", "security"],
  "skills": "./skills/",
  "interface": {
    "displayName": "Block No Verify",
    "shortDescription": "Install a Git bypass-blocking hook with approval.",
    "longDescription": "A Codex skill that recommends and, only after explicit approval, installs and tests a project- or user-scoped PreToolUse policy for Git --no-verify, --no-gpg-sign, and falsy commit.gpgsign bypasses. Installing this plugin enables the skill only; it does not activate a hook.",
    "developerName": "Nery Samuel Murillo",
    "category": "Security",
    "capabilities": [
      "Approval-gated Git hook installation",
      "Git verification and signing bypass detection",
      "Self-contained hook maintenance tests",
      "Codex hook trust and rollback guidance"
    ],
    "websiteURL": "https://forestal-mt.com",
    "privacyPolicyURL": "https://forestal-mt.com/privacy/",
    "termsOfServiceURL": "https://forestal-mt.com/terms/",
    "defaultPrompt": [
      "Use $block-no-verify to assess whether this Git workflow should install the no-verify protection.",
      "Use $block-no-verify to install and test the approved project-scoped Git bypass policy."
    ],
    "brandColor": "#B91C1C"
  }
}
