{
  "name": "astro-cli-commands",
  "version": "0.1.0",
  "description": "Astro Commands gives Codex a maintained, command-first operating contract for Astro projects: inspect the installed CLI, prefer official capabilities, and verify version drift before acting.",
  "author": {
    "name": "Nery Samuel Murillo",
    "email": "nerymurillohnd@gmail.com",
    "url": "https://github.com/nerymurillohnd"
  },
  "homepage": "https://forestal-mt.com",
  "repository": "https://github.com/nerymurillohnd/codex-essentials",
  "license": "MIT",
  "keywords": ["astro", "cli", "code-editing", "codex", "workflows"],
  "interface": {
    "displayName": "Astro Commands",
    "shortDescription": "Use Astro's current CLI capabilities first.",
    "longDescription": "A maintained command-first operating contract for Astro projects. It makes Codex inspect the installed Astro CLI, prefer supported framework commands over improvised workflows, and verify version drift before planning or executing changes.",
    "developerName": "Nery Samuel Murillo",
    "category": "Productivity",
    "capabilities": [
      "Official Astro command selection",
      "Project-local package manager usage",
      "Background dev and preview server handling",
      "CI check and build verification"
    ],
    "websiteURL": "https://forestal-mt.com",
    "privacyPolicyURL": "https://forestal-mt.com/privacy/",
    "termsOfServiceURL": "https://forestal-mt.com/terms/",
    "defaultPrompt": ["Use Astro Commands before planning this Astro task."]
  },
  "skills": "./skills/"
}
